{
  "run_id": "run-002-intermediate-gym-strength-injury",
  "phase": "final_draft",
  "produced_by": "synthesizer",
  "version": 1,
  "status": "validated",
  "created_at": "2026-02-03T09:18:10+00:00",
  "payload": {
    "title": "10-Week Intermediate Upper/Lower Strength Program (Shoulder-Safe)",
    "summary": "A 4-day/week, 10-week upper/lower strength program for an intermediate lifter with full gym access, built around heavy compound lifts in the 3-8 rep range. All overhead pressing is excluded and replaced with a landmine press variant due to a confirmed shoulder impingement.",
    "requirements_recap": {
      "goal": "strength",
      "experience_level": "intermediate",
      "equipment": ["barbell", "dumbbell", "bench", "squat-rack", "cable-machine"],
      "days_per_week": 4,
      "session_length_minutes": 60,
      "constraints": [
        {"type": "injury", "description": "Mild shoulder impingement — avoid overhead pressing specifically.", "contraindication_tags": ["shoulder_overhead"]}
      ]
    },
    "weekly_schedule": [
      {"session_id": "day1", "day_label": "Day 1 — Upper A", "focus": "Horizontal Push + Pull + Accessory"},
      {"session_id": "day2", "day_label": "Day 2 — Lower A", "focus": "Squat + Hinge + Core"},
      {"session_id": "day3", "day_label": "Day 3 — Upper B", "focus": "Push + Pull + Accessory"},
      {"session_id": "day4", "day_label": "Day 4 — Lower B", "focus": "Squat + Hinge + Core"}
    ],
    "safety_notes": [
      "Overhead pressing is intentionally excluded from this entire program due to your confirmed shoulder impingement.",
      "Day 3's press was substituted to Dumbbell Landmine Press, a non-overhead angled pressing pattern, specifically for this reason.",
      "If any exercise still provokes shoulder pain, stop and consult a physical therapist or physician before continuing that movement."
    ],
    "equipment_list": ["barbell", "dumbbell", "bench", "squat-rack", "cable-machine"],
    "sections_order": [
      "Summary",
      "Confirmed Requirements",
      "Weekly Schedule Overview",
      "Session-by-Session Program",
      "Progression Plan",
      "Equipment & Substitutions",
      "Safety Notes",
      "Sources"
    ]
  }
}
